,channel,title,description,pub_date,mp3_url,article_url
2379931,Kama Miku,【12】「いい買い物すると楽しいね」かまってみくのしんLove you,やる気がでねえ→,2020-06-19,https://omocoro.heteml.net/radio/kamamicu/l12/l12.mp3,https://omocoro.jp/radio/237993/
2387491,Kama Miku,【13】「落語を自分のことのように話す奴」かまってみくのしんLove you,オススメの長靴→メール「仮面浪人で悩んでます」→落語を聞いてほしい→来週はこうしよう→クソシャレ前哨戦,2020-06-26,https://omocoro.heteml.net/radio/kamamicu/l13/l13.mp3,https://omocoro.jp/radio/238749/
2399031,Kama Miku,【14】「う●こ事件の真犯人がわかったぞ！」かまってみくのしんLove you,火球の音を聞いた→バーグハンバーグバーグのうんこ事件→バーグハンバーグバーグのうんこ事件の真犯人→容疑者みくのしんの献身→スーパーラジオCD買ってね！,2020-07-03,https://omocoro.heteml.net/radio/kamamicu/l14/l14.mp3,https://omocoro.jp/radio/239903/
2405201,Kama Miku,【15】「みくのしん、ドラッグに手を出す」かまってみくのしんLove you,対面収録は１週持ち越し！→ラジオCD再販するってよ→ヤードムやってみ？→うんこ犯のその後→特撮ヒーローのイベント→来週は息継ぎしよう,2020-07-10,https://omocoro.heteml.net/radio/kamamicu/l15/l15.mp3,https://omocoro.jp/radio/240520/
2411501,Kama Miku,【16】「3ヶ月ぶりに会った男たちのクソシャレ合戦」かまってみくのしんLove you,3ヶ月ぶりじゃないか！→どうせ嘘って言うもん→かまみくリスナーと会った→クソシャレ合戦開幕！→来週は頼むぞみんな！,2020-07-17,https://omocoro.heteml.net/radio/kamamicu/l16/l16.mp3,https://omocoro.jp/radio/241150/
2418291,Kama Miku,「奇声をあげて3万円を獲れ！悲痛な叫びコンテスト開幕！」かまってみくのしんLove you,「学校・会社に行きたくねえ〜〜〜！」そんな時に湧き上がる奇声の出来を競い合う大会「悲痛な叫びコンテスト」を開催します。優勝者には3万円分のギフトカードをプレゼント！“声とであう 声でつながる” 音声配信ソーシャルアプリ 「REC.」のPR企画です,2020-07-24,https://omocoro.heteml.net/radio/kamamicu/l17/l17.mp3,https://omocoro.jp/radio/241829/
2418292,Kama Miku,「奇声をあげて3万円を獲れ！悲痛な叫びコンテスト開幕！」かまってみくのしんLove you,「学校・会社に行きたくねえ〜〜〜！」そんな時に湧き上がる奇声の出来を競い合う大会「悲痛な叫びコンテスト」を開催します。優勝者には3万円分のギフトカードをプレゼント！“声とであう 声でつながる” 音声配信ソーシャルアプリ 「REC.」のPR企画です,2020-07-24,//omocoro.heteml.net/radio/kamamicu/l17/l17.mp3,https://omocoro.jp/radio/241829/
2433971,Kama Miku,【18】「STOP！お菓子の過剰包装！」かまってみくのしんLove you,STOP！お菓子の過剰包装→ARuFaさんに気を遣わせちゃったね→半沢直樹おもしろいよね〜！→モンゴルナイフ急襲！→山下ラジ男が叫び声をあげにやってきた！,2020-07-31,https://omocoro.heteml.net/radio/kamamicu/l18/l18.mp3,https://omocoro.jp/radio/243397/
2459371,Kama Miku,【19】「オンライン脱出ゲームで元気になろう」かまってみくのしんLove you,起こってることがあるんだけど→オンライン脱出ゲームでコロナ鬱から脱出した→門外不出のボツ音源→電気バチと喧嘩して仲直りした→もうあんなことはしない,2020-08-07,https://omocoro.heteml.net/radio/kamamicu/l19/l19.mp3,https://omocoro.jp/radio/245937/
2468101,Kama Miku,【20】「悲痛な叫びコンテスト終了！そして…」かまってみくのしんLove you,怒ってることがあるんだけど→電気バチが来たぞ！→悲痛な叫びコンテストの後夜祭を開催します→電気バチの逆襲,2020-08-14,https://omocoro.heteml.net/radio/kamamicu/l20/l20.mp3,https://omocoro.jp/radio/246810/
2478201,Kama Miku,【21】「泣いた後のシャワーは気持ちがいい」かまってみくのしんLove you,なんでまた電気バチがいるの？→記事対決読んだ？→いいニュースと悪いニュースがあるんだけど→電気バチのnote→ブチギレてるんだけど→みくのしんと電気バチ→嫌なことを思い出した,2020-08-21,https://omocoro.heteml.net/radio/kamamicu/l21/l21.mp3,https://omocoro.jp/radio/247820/
2491481,Kama Miku,【22】「エロ漫画…いっぱい…月額」かまってみくのしんLove you,撮り直ししないと→コンタクトにしたんだけど→世界一お得なサブスクサービスを教えよう,2020-08-28,https://omocoro.heteml.net/radio/kamamicu/l22/l22.mp3,https://omocoro.jp/radio/249148/
2513241,Kama Miku,【24】「ハッピーバースデイ脱糞王」かまってみくのしんLove you,みくのしんは知る由もないけど→サブスクに向いてないみくのしん→誕生日はどうだった？→今年の誕生日プレゼント→クソ,2020-09-11,https://omocoro.heteml.net/radio/kamamicu/l24/l24.mp3,https://omocoro.jp/radio/251324/
2520171,Kama Miku,【25】「お〜い取引先の人！聞いてる〜？」かまってみくのしんLove you,一周年なんだよ→運動ダイエット→「下痢vs便秘」論争決着→夜道で怖い目にあった→打ち合わせで怖い目にあった→リモート飲み会にて,2020-09-18,https://omocoro.heteml.net/radio/kamamicu/l25/l25.mp3,https://omocoro.jp/radio/252017/
2526231,Kama Miku,【26】「HUNTER×HUNTERの話をいっぱいしよう」かまってみくのしんLove you,小一時間、HUNTER×HUNTERの話をしました,2020-09-25,https://omocoro.heteml.net/radio/kamamicu/l26/l26.mp3,https://omocoro.jp/radio/252623/
2538671,Kama Miku,【27】「最近見た良いものを共有しよう」かまってみくのしんLove you,エロ漫画の話→歯医者がクライマックスを迎えた→今年のドラえもんはスゴかった→本を読んだよ→オススメするって大事だね,2020-10-02,https://omocoro.heteml.net/radio/kamamicu/l27/l27.mp3,https://omocoro.jp/radio/253867/
2549571,Kama Miku,【28】「ラジオ聴いてくれてセンキュー」かまってみくのしんLove you,キレてることがある→オススメされた本を読んだ→まだ40分も経ってない→料理をするようになった→パン屋との雪解け→今年も大詰めだね,2020-10-09,https://omocoro.heteml.net/radio/kamamicu/l28/l28.mp3,https://omocoro.jp/radio/254957/
2556421,Kama Miku,【29】「くっぞこたいくっぞこ」かまってみくのしんLove you,「中目黒で…」→いいニュースと悪いニュースがある→みくのしんの卵焼き→見切り品で唯一おトクになる食べ物→声に出して感動しよう→家族Zoomした話,2020-10-16,https://omocoro.heteml.net/radio/kamamicu/l29/l29.mp3,https://omocoro.jp/radio/255642/
2566881,Kama Miku,【30】「決めよう！！！！」かまってみくのしんLove you,ゲストがきたぞ→いい先輩と思われたい→みくのしんの愚痴→決めよう！！！！,2020-10-23,https://omocoro.heteml.net/radio/kamamicu/l30/l30.mp3,https://omocoro.jp/radio/256688/
2574851,Kama Miku,【31】「ボトルマンめっっっっちゃ面白い！！」かまってみくのしんLove you,ボトルマンを手に入れたぞ！→ホットスナック同盟の危機→煽り厨のアップルウォッチ→みくのしん健康の悩み→2020年ポテンラジオ計画,2020-10-30,https://omocoro.heteml.net/radio/kamamicu/l31/l31.mp3,https://omocoro.jp/radio/257485/
2584951,Kama Miku,【32】「Go To Eatに物申すぞ！みくのしんが」かまってみくのしんLove you,今日は何もないよ→リングフィット買ったのよ→Go To Eatに縛られた男たち→みくのしんポテンラジオ計画→ラジオの途中でさ…,2020-11-06,https://omocoro.heteml.net/radio/kamamicu/l32/l32.mp3,https://omocoro.jp/radio/258495/
2595661,Kama Miku,【33】「Go To Eatに物申すぞ！みくのしんが part2」かまってみくのしんLove you,あ〜！,2020-11-13,https://omocoro.heteml.net/radio/kamamicu/l33/l33.mp3,https://omocoro.jp/radio/259566/
2608501,Kama Miku,【34】「みくのしんの頭がおかしくなりました」かまってみくのしんLove you,みくのしんが頭おかしくなった→映画「魔女見習いを探して」を見た→みくのしんの怖い話→初めてピクミンやった,2020-11-20,https://omocoro.heteml.net/radio/kamamicu/l34/l34.mp3,https://omocoro.jp/radio/260850/
2616351,Kama Miku,【35】「マジくそヤラセ本物ロシアンルーレット」かまってみくのしんLove you,天気の話→桃鉄の話→マジくそヤラセ本物ロシアンルーレット→マジくそ本物ロシアンルーレット→勉強すすんでる？,2020-11-27,https://omocoro.heteml.net/radio/kamamicu/l35/l35.mp3,https://omocoro.jp/radio/261635/
2625971,Kama Miku,【36】「金の話になるとマジだから」かまってみくのしんLove you,天気の話→みくのしんはなめられている→元ネタ当てっこ,2020-12-04,https://omocoro.heteml.net/radio/kamamicu/l36/l36.mp3,https://omocoro.jp/radio/262597/
2638391,Kama Miku,【37】「寝るたびに俺は死体に近づいている」かまってみくのしんLove you,今日は疲れ切っている→ブチギレてるんだけど→みくのしんのオモコロ特集→20万の買い物→マットレスの思い出→ヨギボーの思い出→ゴーイングメリーフライパン→ちょっとした話,2020-12-11,https://omocoro.heteml.net/radio/kamamicu/l37/l37.mp3,https://omocoro.jp/radio/263839/
2657691,Kama Miku,【38】「エロ漫画の話をするよ」かまってみくのしんLove you,寒いね→M-1グランプリ楽しみだね→エロ漫画の話をするよ→明日の夜はリモート飲み会だ,2020-12-18,https://omocoro.heteml.net/radio/kamamicu/l38/l38.mp3,https://omocoro.jp/radio/265769/
2671071,Kama Miku,【39】「80歳になってから聴く音源」かまってみくのしんLove you,今日は調子がいい→靴を買ったんだけど→スシローの話→80歳になってから聴く音源,2020-12-25,https://omocoro.heteml.net/radio/kamamicu/l39/l39.mp3,https://omocoro.jp/radio/267107/
2683861,Kama Miku,【40】「忘年会の時の音源」かまってみくのしんLove you,ZOOMで慰労会をひらいた時に、ついでに録音していた音源です,2021-01-01,https://omocoro.heteml.net/radio/kamamicu/l40/l40.mp3,https://omocoro.jp/radio/268386/
2689081,Kama Miku,【41】「家にいたから褒めてほしい」かまってみくのしんLove you,みくコロ2021→正月何してた？→オンライン帰省したよ→また靴を買ったみくのしん→恋愛相談なんてやっちゃうんだから,2021-01-08,https://omocoro.heteml.net/radio/kamamicu/l41/l41.mp3,https://omocoro.jp/radio/268908/
2695501,Kama Miku,【42】「かまみくリモート」かまってみくのしんLove you,かまみくリモート再来！→記事の悪魔→オモコロ特集の裏話→ラベルレスのペットボトル→脂肪が燃える音がした,2021-01-15,https://omocoro.heteml.net/radio/kamamicu/l42/l42.mp3,https://omocoro.jp/radio/269550/
2700701,Kama Miku,【43】「ラジオ中に電話がかかってくるなんて」かまってみくのしんLove you,リモート〜〜〜〜〜,2021-01-22,https://omocoro.heteml.net/radio/kamamicu/l43/l43.mp3,https://omocoro.jp/radio/270070/
2712881,Kama Miku,【44】「検便の話でスタートを切ろう」かまってみくのしんLove you,リモート〜〜〜〜〜,2021-01-29,https://omocoro.heteml.net/radio/kamamicu/l44/l44.mp3,https://omocoro.jp/radio/271288/
2721271,Kama Miku,【45】「岡田悠さんに教えを乞う」かまってみくのしんLove you,リモート〜〜〜〜〜,2021-02-05,https://omocoro.heteml.net/radio/kamamicu/l45/l45.mp3,https://omocoro.jp/radio/272127/
2728511,Kama Miku,【46】「くそラジオ」かまってみくのしんLove you,リモート〜〜〜〜〜,2021-02-12,https://omocoro.heteml.net/radio/kamamicu/l46/l46.mp3,https://omocoro.jp/radio/272851/
2741441,Kama Miku,【47】「高いところは苦手だ」かまってみくのしんLove you,リモート〜〜〜〜〜,2021-02-19,https://omocoro.heteml.net/radio/kamamicu/l47/l47.mp3,https://omocoro.jp/radio/274144/
2757671,Kama Miku,【48】「みくのしんを信じきれていなかった」かまってみくのしんLove you,リモート〜〜〜〜〜,2021-02-26,https://omocoro.heteml.net/radio/kamamicu/l48/l48.mp3,https://omocoro.jp/radio/275767/
2774451,Kama Miku,【49】「花粉症でダメになったみくのしん」かまってみくのしんLove you,リモート〜〜〜〜〜,2021-03-05,https://omocoro.heteml.net/radio/kamamicu/l49/l49.mp3,https://omocoro.jp/radio/277445/
2782571,Kama Miku,【50】「エクスキューズミー」かまってみくのしんLove you,リモート〜〜〜〜〜,2021-03-12,https://omocoro.heteml.net/radio/kamamicu/l50/l50.mp3,https://omocoro.jp/radio/278257/
2794321,Kama Miku,【51】「僕らのヒーローごとうさん」かまってみくのしんLove you,リモート〜〜〜〜〜,2021-03-19,https://omocoro.heteml.net/radio/kamamicu/l51/l51.mp3,https://omocoro.jp/radio/279432/
2805221,Kama Miku,#972000「今シーズン最終回！」かまってみくのしんLove you,久しぶりに対面収録→かまどのついてない日→八つ脳の加味條→note連続更新が途絶えた→次シーズンの名前,2021-03-26,https://omocoro.heteml.net/radio/kamamicu/l972000/l972000.mp3,https://omocoro.jp/radio/280522/
2817051,Kama Miku,【01】作業用かまみく「ここが本当の出発点」,キッチン掃除のおともにちょうどいいかも知れない1時間くらいのラジオです,2021-04-02,https://omocoro.heteml.net/radio/kamamicu/ks1/ks1.mp3,https://omocoro.jp/radio/281705/
2827181,Kama Miku,【02】作業用かまみく「隣人トラブルにトドメを刺せ！」,家事のおともにちょうどいいかも知れない1時間10分くらいのラジオです,2021-04-09,https://omocoro.heteml.net/radio/kamamicu/ks2/ks2.mp3,https://omocoro.jp/radio/282718/
2835331,Kama Miku,【03】作業用かまみく「みくのしんは国に1円を搾取されている」,半身浴のおともにちょうどいいかも知れない30分くらいのラジオです,2021-04-16,https://omocoro.heteml.net/radio/kamamicu/ks3/ks3.mp3,https://omocoro.jp/radio/283533/
2847151,Kama Miku,【04】作業用かまみく「今まで住んだ街の思い出を最悪な気持ちで振り返る」,犬の散歩のおともにちょうどいいかも知れない1時間15分のラジオです,2021-04-23,https://omocoro.heteml.net/radio/kamamicu/ks4/ks4.mp3,https://omocoro.jp/radio/284715/
2855461,Kama Miku,【05】作業用かまみく「オモコロイベントが終わったって！」,失恋を忘れるのにちょうどいいかも知れない1時間30分以上のラジオです,2021-04-30,https://omocoro.heteml.net/radio/kamamicu/ks5/ks5.mp3,https://omocoro.jp/radio/285546/
2868821,Kama Miku,【06】作業用かまみく「10万円返してくれ！」,廃墟の凸配信のBGMにちょうどいいかも知れない1時間のラジオです,2021-05-07,https://omocoro.heteml.net/radio/kamamicu/ks6/ks6.mp3,https://omocoro.jp/radio/286882/
2876381,Kama Miku,【07】作業用かまみく「映画の知識をひけらかすことは罪なのか？」,ハローワークへ向かう途中に聴くBGMにちょうどいいかも知れない1時間のラジオです,2021-05-14,https://omocoro.heteml.net/radio/kamamicu/ks7/ks7.mp3,https://omocoro.jp/radio/287638/
2887151,Kama Miku,【08】作業用かまみく「リスナーの人生を変えちまった」,お出かけの往復時間に聴くBGMにちょうどいいかも知れない1時間のラジオです,2021-05-21,https://omocoro.heteml.net/radio/kamamicu/ks8/ks8.mp3,https://omocoro.jp/radio/288715/
2900011,Kama Miku,【09】作業用かまみく「みくのしんのパーフェクト算数教室」,クンニにちなんだ92分のラジオです,2021-05-28,https://omocoro.heteml.net/radio/kamamicu/ks9/ks9.mp3,https://omocoro.jp/radio/290001/
2911501,Kama Miku,【10】作業用かまみく「生まれて初めて催眠術にかかってみたら」,また歩き出すときのおともにちょうどいいかもしれない2時間のラジオです,2021-06-04,https://omocoro.heteml.net/radio/kamamicu/ks10/ks10.mp3,https://omocoro.jp/radio/291150/
2921891,Kama Miku,【11】作業用かまみく「ARuFaは強い。みくのしんは最強」,ARuFaをゲストに迎えて送る1時間くらいのラジオです,2021-06-11,https://omocoro.heteml.net/radio/kamamicu/ks11/ks11.mp3,https://omocoro.jp/radio/292189/
2939001,Kama Miku,【12】作業用かまみく「今日はパワポケの話しかしないよ」,園芸作業のお供にちょうどいいかもしれない1時間半くらいのラジオです,2021-06-18,https://omocoro.heteml.net/radio/kamamicu/ks12/ks12.mp3,https://omocoro.jp/radio/293900/
2946101,Kama Miku,【13】作業用かまみく「みくのしんが号泣する回」,謝罪に向かう途中のBGMにちょうどいいかもしれない1時間半くらいのラジオです,2021-06-25,https://omocoro.heteml.net/radio/kamamicu/ks13/ks13.mp3,https://omocoro.jp/radio/294610/
2956341,Kama Miku,【14】作業用かまみく「オモコロライターが号泣する回」,境内の草引きなどの作務中のBGMにちょうどいいかもしれない1時間半くらいのラジオです,2021-07-02,https://omocoro.heteml.net/radio/kamamicu/ks14/ks14.mp3,https://omocoro.jp/radio/295634/
2966951,Kama Miku,【15】作業用かまみく「2人でブチギレる回」,客入れBGMにちょうどいいかもしれない50分くらいのラジオになるはずでした,2021-07-09,https://omocoro.heteml.net/radio/kamamicu/ks15/ks15.mp3,https://omocoro.jp/radio/296695/
2982941,Kama Miku,【16】作業用かまみく「みくのしんのアナルがめくれる回」,みくのしんの仕事中に収録したラジオです,2021-07-16,https://omocoro.heteml.net/radio/kamamicu/ks16/ks16.mp3,https://omocoro.jp/radio/298294/
2997831,Kama Miku,【17】作業用かまみく「モンゴルナイフと男根のしわ」,モンゴルナイフをゲストに迎えて収録したラジオです,2021-07-23,https://omocoro.heteml.net/radio/kamamicu/ks17/ks17.mp3,https://omocoro.jp/radio/299783/
3009441,Kama Miku,【18】作業用かまみく「Your speech is too long」,1時間10分で終わるはずだったラジオです,2021-07-30,https://omocoro.heteml.net/radio/kamamicu/ks18/ks18.mp3,https://omocoro.jp/radio/300944/
3021091,Kama Miku,【19】作業用かまみく「今日のみくのしんは限界を越えるぞ」,就活の不安を忘れられるかもしれない2時間のラジオです,2021-08-06,https://omocoro.heteml.net/radio/kamamicu/ks19/ks19.mp3,https://omocoro.jp/radio/302109/
3033121,Kama Miku,【20】作業用かまみく「うんこのナス」,みくのしんが頑張って編集した2時間のラジオです。（そう）,2021-08-13,https://omocoro.heteml.net/radio/kamamicu/ks20/ks20.mp3,https://omocoro.jp/radio/303312/
3040491,Kama Miku,【21】作業用かまみく「俺たちのポケモンジム設営計画」,天国に行ける2時間のラジオです,2021-08-20,https://omocoro.heteml.net/radio/kamamicu/ks21/ks21.mp3,https://omocoro.jp/radio/304049/
3051581,Kama Miku,【22】作業用かまみく「かまどが限界を超える回」,2時間を超えないように頑張ったラジオです,2021-08-27,https://omocoro.heteml.net/radio/kamamicu/ks22/ks22.mp3,https://omocoro.jp/radio/305158/
3064961,Kama Miku,【23】作業用かまみく「みくのしんが激怒したあとに泣く回」,海の音と一緒に聞いている人もいる1時間半くらいのラジオです,2021-09-03,https://omocoro.heteml.net/radio/kamamicu/ks23/ks23.mp3,https://omocoro.jp/radio/306496/
3076921,Kama Miku,【24】作業用かまみく「うんこに残ったコーンはもったいないのか？」,彼女との仲直りに使えるかもしれない1時間半くらいのラジオです,2021-09-10,https://omocoro.heteml.net/radio/kamamicu/ks24/ks24.mp3,https://omocoro.jp/radio/307692/
3088611,Kama Miku,【25】作業用かまみく「ドリンクバーで悩むならビールを飲め」,浮気されたショックを束の間忘れられるかもしれない1時間半くらいのラジオです,2021-09-17,https://omocoro.heteml.net/radio/kamamicu/ks25/ks25.mp3,https://omocoro.jp/radio/308861/
3095821,Kama Miku,【26】作業用かまみく「バカが運営するデスゲームはこうなる」,ファンレターをしたためる時のBGMに使えるかもしれない1時間半くらいのラジオです,2021-09-24,https://omocoro.heteml.net/radio/kamamicu/ks26/ks26.mp3,https://omocoro.jp/radio/309582/
3107121,Kama Miku,【27】作業用かまみく「たかがペヤングで大冒険するな」,コンビニスイーツのお供にちょうどいいかもしれない1時間のラジオです,2021-10-01,https://omocoro.heteml.net/radio/kamamicu/ks27/ks27.mp3,https://omocoro.jp/radio/310712/
3118961,Kama Miku,【28】作業用かまみく「恐山とみくのしんの天ぷら相撲」,ダ・ヴィンチ・恐山をゲストに迎えてお送りする1時間くらいのラジオです,2021-10-08,https://omocoro.heteml.net/radio/kamamicu/ks28/ks28.mp3,https://omocoro.jp/radio/311896/
3127251,Kama Miku,【29】作業用かまみく「夢と魔法の国みくのしんランド」,さつまいもを蒸す間の待ち時間にちょうどいいかもしれない1時間以上のラジオです,2021-10-15,https://omocoro.heteml.net/radio/kamamicu/ks29/ks29.mp3,https://omocoro.jp/radio/312725/
3144051,Kama Miku,【30】作業用かまみく「超ノジコって何？」,バーグハンバーグバーグの永田さんとラジオしました。,2021-10-22,https://omocoro.heteml.net/radio/kamamicu/ks30/ks30.mp3,https://omocoro.jp/radio/314405/
3162001,Kama Miku,【31】作業用かまみく「俺たちは勝つ」,副社長をボコボコにするのにちょうどいいかもしれない1時間半くらいのラジオです,2021-10-29,https://omocoro.heteml.net/radio/kamamicu/ks31/ks31.mp3,https://omocoro.jp/radio/316200/
3169691,Kama Miku,【32】作業用かまみく「麦わらのルヒィーとみくのしんのIT海賊団」,寝る前の気休めにちょうどいいかもしれない1時間くらいのラジオです,2021-11-05,https://omocoro.heteml.net/radio/kamamicu/ks32/ks32.mp3,https://omocoro.jp/radio/316969/
3180821,Kama Miku,【33】作業用かまみく「泣いたみくのしんと脱糞実況主」,世界記録を狙うのにちょうど良いかもしれない1時間40分くらいのラジオです,2021-11-12,https://omocoro.heteml.net/radio/kamamicu/ks33/ks33.mp3,https://omocoro.jp/radio/318082/
3186081,Kama Miku,【34】作業用かまみく「2人だけの世界」,就活のおともにちょうど良いかもしれない1時間以上のラジオです,2021-11-19,https://omocoro.heteml.net/radio/kamamicu/ks34/ks34.mp3,https://omocoro.jp/radio/318608/
3202301,Kama Miku,【35】作業用かまみく「立ち上がれ！ゆでたまご戦士たち」,通院や受験のおともにちょうど良いかもしれない1時間半以上のラジオです,2021-11-26,https://omocoro.heteml.net/radio/kamamicu/ks35/ks35.mp3,https://omocoro.jp/radio/320230/
3218081,Kama Miku,【36】作業用かまみく「あつまれ！ゆでたまご戦士たち」,失恋や嫌な社員旅行を忘れるのにちょうど良いかもしれない1時間半以上のラジオです,2021-12-03,https://omocoro.heteml.net/radio/kamamicu/ks36/ks36.mp3,https://omocoro.jp/radio/321808/
3227481,Kama Miku,【37】作業用かまみく「豚肉の茹で汁で足湯を作ろう」,骨折の療養にちょうど良いかもしれない2時間のラジオです,2021-12-10,https://omocoro.heteml.net/radio/kamamicu/ks37/ks37.mp3,https://omocoro.jp/radio/322748/
3231701,Kama Miku,【38】作業用かまみく「みくのしんはうんこをくっている」,無駄にした時間を取り戻せるかもしれない1時間のラジオです,2021-12-17,https://omocoro.heteml.net/radio/kamamicu/ks38/ks38.mp3,https://omocoro.jp/radio/323170/
3247571,Kama Miku,【38】作業用かまみく「みんなのはかいこうせん」,うんこを拭くために使える1時間以上のラジオです,2021-12-24,https://omocoro.heteml.net/radio/kamamicu/ks39/ks39.mp3,https://omocoro.jp/radio/324757/
3257401,Kama Miku,【40】作業用かまみく「ジョジョで口をイーッってしてるスタンド総選挙」,無駄にした時間を取り戻すために聞く1時間48分のラジオです,2021-12-31,https://omocoro.heteml.net/radio/kamamicu/ks40/ks40.mp3,https://omocoro.jp/radio/325740/
3262021,Kama Miku,【41】作業用かまみく「20年ぶりにポケモンをやった男」,お正月気分を引きずった1時間以上のラジオです,2022-01-07,https://omocoro.heteml.net/radio/kamamicu/ks41/ks41.mp3,https://omocoro.jp/radio/326202/
